{
  "adoption": {
    "approved_on": "2026-10-17",
    "authority": "standing_user_delegation",
    "contract_sha256": "6dd7a201dab44fac9bb782c93d02229f081105d93511db5e66c8e6c407258bf9",
    "evidence": [
      "https://github.com/TracecatHQ/tracecat/blob/c84d52528a489821f355fc63976fbc7783ae0ad5/tracecat/tables/schemas.py",
      "https://github.com/TracecatHQ/tracecat/blob/c84d52528a489821f355fc63976fbc7783ae0ad5/tracecat/tables/service.py",
      "https://github.com/TracecatHQ/tracecat/blob/c84d52528a489821f355fc63976fbc7783ae0ad5/tracecat/tables/router.py",
      "The authorized table:create routes validate TableCreate and TableColumnCreate; the exact service validates names again, and column DDL wraps identifiers with quote_identifier."
    ],
    "policy_version": "autonomous-contracts-v1",
    "rationale": "A narrowly scoped source-backed theorem that table and column request validators reject SQL double quotes is useful as a request-layer regression gate because the pinned raw DDL helper uses double-quoted identifiers. The exact service also rejects quotes before DDL, so this contract makes no current vulnerability or impact claim.",
    "review": {
      "author": "Codex P2 source-review pass",
      "reviewer": "Codex exact-source and sink reviewer",
      "same_model": true
    },
    "source_file": "tracecat/tables/schemas.py",
    "source_pin": "c84d52528a489821f355fc63976fbc7783ae0ad5",
    "source_sha256": "3cf61426a27e200640ad55406dc3f67ee7cd445b2cf70d73205e0709b594e881",
    "source_url": "https://github.com/TracecatHQ/tracecat",
    "status": "approved"
  },
  "declared_domain": "A single character from the exact Python re language admitted by IDENTIFIER_PATTERN in the pinned source. The product gate additionally exercises TableCreate.name and TableColumnCreate.name at their pinned 1..100 length bounds. Existing stored names and direct callers outside the named routes are not covered.",
  "guarantee": "The pinned TableCreate.name and TableColumnCreate.name request validators reject a double quote before values reach table or column creation. This protects the raw double-quoted identifier formatting used by the pinned DDL path. The contract does not claim SQL injection, attacker reachability, or deployed impact; the service also applies its stricter validate_identifier check before DDL.",
  "input_source": "Names are supplied as workspace table and column configuration to authenticated table routes guarded by table:create. The public routes validate TableCreate and TableColumnCreate models before calling TablesService. The service validates names again before dynamic DDL; column DDL formats identifiers with quote_identifier.",
  "provenance": "agent_derived",
  "schema_version": "1",
  "site": "TracecatHQ/tracecat@c84d52528a489821f355fc63976fbc7783ae0ad5:tracecat/tables/schemas.py:17:re.compile",
  "trust": "config"
}
