{
  "adoption": {
    "approved_on": "2026-10-15",
    "authority": "standing_user_delegation",
    "contract_sha256": "07fc29b88285903f6d72cd9bd73eab74ed9e09120e3a00eea84fea3dcbcf0217",
    "evidence": [
      "https://github.com/marcusquinn/aidevops/blob/8666b6c6c52472b5535aa295f2df593918152cb1/.agents/plugins/opencode-aidevops/quality-hooks-secret-read.mjs",
      "https://github.com/marcusquinn/aidevops/blob/8666b6c6c52472b5535aa295f2df593918152cb1/.agents/plugins/opencode-aidevops/quality-hooks.mjs",
      "https://github.com/marcusquinn/aidevops/blob/8666b6c6c52472b5535aa295f2df593918152cb1/.agents/plugins/opencode-aidevops/source-access-approval.mjs"
    ],
    "policy_version": "autonomous-contracts-v1",
    "rationale": "The frozen selected-site review traces model-controlled read paths through the exact pinned pre-tool caller and fallback gate. The contract is limited to 64 case variants of one declared basename; product replay checks the three supported read tools, and the contract excludes policy completeness and false-positive claims.",
    "review": {
      "author": "codex-contract-author",
      "reviewer": "codex-independent-review-pass",
      "same_model": true
    },
    "source_file": ".agents/plugins/opencode-aidevops/quality-hooks-secret-read.mjs",
    "source_pin": "8666b6c6c52472b5535aa295f2df593918152cb1",
    "source_sha256": "668f7dc002b263d58def6003194fd83dfa91b82b2fdcb9a10b1427f1cb942cf0",
    "source_url": "https://github.com/marcusquinn/aidevops",
    "status": "approved"
  },
  "declared_domain": "Exhaustive finite set of the 64 ASCII upper/lower-case variants of the basename `secret`; the formal query checks membership in the source regex under search semantics. Product replay checks representative sensitive basenames and the earlier `.pub` exception across Read, Glob, and NotebookRead, checks a non-read tool, and verifies a real source mutation. Sampled path cases are not an unbounded theorem over all paths.",
  "guarantee": "For the finite declared domain of 64 ASCII case variants of basename `secret`, the pinned SECRET_BASENAME_RE matches each value with search semantics. In the product helper these basenames produce the `secret-bearing basename` block reason for OpenCode Read, Glob, and NotebookRead tools before the read executes. This does not establish list completeness, false-positive rates, or the behavior of other path predicates.",
  "input_source": "The path supplied in a model-controlled OpenCode Read, Glob, or NotebookRead call. The pinned pre-tool hook routes it through checkSecretReadWithApproval and the ordinary path falls back to checkSecretReadGate.",
  "provenance": "agent_derived",
  "schema_version": "1",
  "site": "marcusquinn/aidevops@8666b6c6c52472b5535aa295f2df593918152cb1:.agents/plugins/opencode-aidevops/quality-hooks-secret-read.mjs:7:SECRET_BASENAME_RE",
  "trust": "untrusted-input"
}
